{"nav_expectation":"loot_focus_nav","lighting_expectation":"reward_contrast","id":"kit.room.loot.vault","display_name":"Loot Vault","width_meters":"12","connector_class":"spur","depth_meters":"10","archetype":"loot_room","height_meters":"6","review_record_id":"review.room.kit.room_variant.machine_silo.salvage_nook"}
