{"nav_expectation":"single_lane_nav","lighting_expectation":"cool_guidance","id":"kit.room.corridor.narrow","display_name":"Narrow Corridor","width_meters":"8","connector_class":"linear","depth_meters":"20","archetype":"corridor","height_meters":"5","review_record_id":"review.room.kit.room_variant.machine_silo.patrol_hall"}
