{"nav_expectation":"clear_exit_nav","lighting_expectation":"countdown_focus","id":"kit.room.extraction.pad","display_name":"Extraction Pad","width_meters":"12","connector_class":"terminus","depth_meters":"12","archetype":"extraction_room","height_meters":"7","review_record_id":"review.room.kit.room_variant.machine_silo.extraction_pad"}
