{"nav_expectation":"hidden_route_nav","lighting_expectation":"mystery_pool_lighting","id":"kit.room.secret.bypass","display_name":"Secret Bypass","width_meters":"10","connector_class":"secret","depth_meters":"8","archetype":"secret_shortcut_room","height_meters":"5","review_record_id":"review.room.kit.room_variant.machine_silo.high_risk_vault"}
