{"nav_expectation":"flank_cover_nav","lighting_expectation":"threat_silhouette","id":"kit.room.ambush.killbox","display_name":"Ambush Killbox","width_meters":"14","connector_class":"combat","depth_meters":"14","archetype":"ambush_room","height_meters":"6","review_record_id":"review.room.kit.room_variant.machine_silo.guard_post"}
