{"nav_expectation":"layered_vertical_nav","lighting_expectation":"path_highlight","id":"kit.room.traversal.catwalk","display_name":"Traversal Catwalk","width_meters":"16","connector_class":"traversal","depth_meters":"12","archetype":"puzzle_traversal_room","height_meters":"8","review_record_id":"review.room.kit.room_variant.machine_silo.generator_room"}
