{"nav_expectation":"multi_lane_nav","lighting_expectation":"signage_pool_lighting","id":"kit.room.hub.crossroads","display_name":"Crossroads Hub","width_meters":"18","connector_class":"hub","depth_meters":"18","archetype":"hub","height_meters":"7","review_record_id":"review.room.kit.room_variant.machine_silo.entry_platform"}
